제목,내용,게시자,게시날짜
Lovesick,ㅋㅋ 11년만에 느껴보니까 아주 맛 좋구나 그래 브리즈 덕메 +1 상시모집하고 있어요 라이즈 많관부 고양이 뱃살건조대 버터맥주 컵에 찐맥주 마시기...,ʏᴇᴀʀs s ʏᴏᴜɴɢ,4주 전
죽지도 않고 또 왔네,"& 많관부 희랑 떤두랑 상남동 pppp 저녁 먹으러 옴 #창원맛집 첨으로 가봤는데 만족 만족 개만족 셋이서 푸드파이터 하고 나옴 ㅋㅋ 밥 다 먹고 커피 먹으면서 소화시키고 집으로 귀가! 김 자매와 함께하는 추억의 엉클 ,, 하나두 안 변했네 드렁큰 김2 조1 2차로 노래방 언제나...",조대식 블로그,4주 전
"제주 구좌 오름,가을 억새가 절경이었던 '손지오름'(Feat.주차장,정상가는길)",수필+소개 형식으로 글을 써내려갈 예정이니 많관부 ~ 이번에 올라간 오름은 '손지오름' 동쪽의 유명한 오름은 다 올라가봐서 이제 안유명한 오름을 가보자!하고 호기롭게 도전했다 오르머수첩을 보면 가을억새철에 올라가기 좋은 오름이라고 써있어서 7시출근 - 4시 퇴근한...,메르디의 알찬 기록,4주 전
10월 -,하다가 다음 화면 넘어가면 위하준 미쳤네... 존잘... 하다 보면 한 회 끝남ㅋㅋㅋ 이렇게 어찌저찌 10월기장 급마무링ㅋㅋㅋ 이번 달엔 생각보다 사진을 별로 안 찍었네 next month부터 다시 열심히 try 해볼게요... i am 진심이에요~ 다들 ~,ㅤㅤ,4주 전
2023. 하늘 연 달,"감회가 넘 새롭고, 블로그를 통해 주변 사람들과 다시 소통하고, 더 친해질 수 있었기도 하고 또 그 때의 나는 어떤 걸 좋아했고, 어떤 감정을 느꼈는지 고스란히 담긴 공간이라 사랑하지 않을 수 없는 듯 해 아직 그만둘 생각 절/ 대/ 없/ 음 앞으로도 !!! 11월도...",Charming.,4주 전
[일상] 모르게 너를 속여 전부를 뺏어,드디어 케이팝의 신이 강림했습니다 많관부 이건 걍 웃겨서... 그럼 쭈고~ @미쁘동 성수 쩝쩝박사 짤로 시작하는 이번 일상글 인스타 보다가 발견한 개맛도리집이 마침 성수에 있대서 지수랑 다녀왔어요 약간 성수랑 멀긴 한데 암튼 그쯤임... 골목에서 연남동 냄새 나서 약간...,나락도 락이다,4주 전
"2023, 10월 일상 브이로그(with 푸바옹:-)","가는길에 본 불광천 파발누리축제 많관부,,, 피부과 가기전에 들린 산보클럽 카페 평일이라 사람이 많이 없어서 좋아따 ㅜㅜ 내부는 아기자기하고 식물이 은근 있었다아! 뭔가 포근하고 집에 온 분위기? ㅋㅋㅋㅋㅋㅋㅋㅋㅋㅋㅋㅋ 아이스 필터커피 오리지널 (5,800원)...",행복그잡채,4주 전
그의 계절이 지나가고 있습니다,투새드투댄스 많관부 ㅂㅌ 10월 걍 끝남. 끝났어 그냥. 고개를 돌리면 온 세상이 푸르던 더운 여름이 엊그제같은데 벌써 노란 나뭇잎들이 길을 물들이고 있구만요 나무들이 한올한올 옷을 벗기 시작하면 나는 하나씩 더 챙겨입기 시작함..... 얘들아 다음달도 잘 부탁한다!...,kooking-Log,4주 전
10월의 근황 !,이사하고 너무너무 좋은데 한편으로는 차로 15분거리지만 .. 20년 넘게 살아온곳과 떨어지니 좀 낯설기도 하고 ... 알수없는 감정이 미묘하게 들기도 한다 도경이의 여의도 라이프 많관부 놀러오세요~ 다음 블로그는 적응한 이도경으로 돌아오쥬,일기장 with구름,4주 전
미하 이토준지 키링,나는 이토준지 마니아인데 망원동에 위치한 #미하 대표님이 선물로 주신 키링! 진짜 미쳤다 너무 예쁘고 맘에 든다 ! 감사합니다❤️ 체고 미하 ! 곧 미하와 함께 할 체리드라이버와의 협업과 빈티지 포스터 전시회도 많관부 #미하 #이토준지 #키링 #키체인 #itojunji,Cherry Driver,4주 전
몰아쓰는 10월 일상 2 (맛있는 것과 배구만 있으면 어디든 갈 수 있어),예쁘니까 많관부 오뎅 동그라미 미친 거 아니야 넘귀여워 쉬는날 엄마랑 본 영화 우리는 모두 어른이 될 수 없었다 우리집 석양 맛집 10월 23일 우리언니 생일!!! 엄마가 맛있는 잡채랑 미역국 해줬다 출근 전에 같이 케이크도 먹음 우리집 갱얼쥐가 너무 귀여워서 한 컷 나...,시무SHIMU의 맛있는 블로그,4주 전
랑부님들 신혼집 쇼파 관련 많은 조언 부탁드려용 ^_^,이거는 직접 써본 분들의 의견이 진짜 중요할 거 같아서 많관부에용 ㅎㅎ 마지막으로 가격! 보통 얼마정도에 하세요!? 저희는 세칸짜리 쇼파(with 리클라이너) 가격 봤을때 공시가긴 한데 200초~300초로 보이거든요? 비싼건지 싼건지 감이 안잡혀요 ㅠㅠ 보통 얼마정도에...,다이렉트웨딩카페-제이웨딩 결혼준비싸게하기,4주 전
9박 10일 나고야 여행기 (1),"쓰다가 나도 모르게 스르륵 잠듦 이렇게 나고야 1일차를 무사히 잘 보냈다! 글이 너무 길어져서 2일차부턴 좀 줄여써야하나 싶다 여행기는 기록용으로 쓸 예정이라 재미는 (원래 없었지만) 포기해야할듯,, ㅎ 걍 뭐하고 놀고 먹었는지 긔엽게 봐주시기 ㅋ 2일차도 ~~",bobo house,4주 전
안녕하세요 ^^ 명국에 새로 오픈한 리얼펍 살얼음맥주 입니다!! 오픈행사 안내드려요~,"안녕하세요 명지국제신도시에 새로 오픈한 리얼펍 살얼음맥주 입니다!! 11월 한 달간 오픈 행사가 있어서 안내드려요 11월 한 달간 모든 분들께 살얼음 맥주 한잔을 2000원!!에 모십니다 일반 생맥주 외에도 호가든, 코젤다크 생맥주도 있구요! 소주...","명지에코맘 ♥ 명지맘,에코맘카페-국제신도시,오션,에코델타시티",4주 전
시월,유튜브도 찾아보니까 있길래 봤어…..ㅜㅠㅠㅠ 그리고 냅다 구독 갈김ㅋㅎㅋㅎㅋㅎㅋㅎㅋ 평석 희지 커플 유튜브랑 지우웅니 유튜브도 있으니까 많관부… 다들 열아홉스물 보세요!!!!! 더러워서ㅜ미안해??? 찍는걸 까먹어서… 먹다가 안 찍은거 생각나서 급하게 찍어서...,행복이 가득하길 빌어,4주 전
"October, 2023","발매함 많관부 11곡이나 되니까 맘에 드는 곡으로 골라 잡수면 됨 in the mood랑 불꽃, bittersweet, here i am 추천함 정휜 힘들지마 행복만해.. 1013 출처 트위터 연인 파트2 시작했다 시험기간이 뭐가 중요^^? 드라마 덕분에 살아갑니다 우리 길채 버석해진것좀 봐 뽀짝하던 애기씨...",lee,4주 전
It’s 10월 이예오 ~,사왔어 ㅡㅡ 내년에 다시 30으로 해줄게요 우리 곤듀들 예쁘조 그만하라고요? 시러요! 맛나는 행포케.. 스파이시연어 세젤맛.. 10월 마지막날은 존경하는 과장님들과 병하와 회식쓰! 10월은 정말 자잘자잘 약속이 많아 행복쿠~~ 11월은 드디어 자취 시쟉합니다 .. ❤️ .. ❤️,Recording.,4주 전
10월 일기,30 운동계정을 하나 새로 만들었어요 운동 기록할라구ㅎ 급찐급빠할때 해보니까 재밌더군요 많관부>_< 전공인데 식물 미술그리는 시간이 있다? 덕분에 어대 분수쇼 이쁘게 보고왔슴닷 ㅋㅎㅋㅎ 재밌었다아 어쩌다보니 19 파티파티파티~ 10월이 또 어찌저찌 끝났네요 아니...,마자 디스 이즈 마이 기록,4주 전
불독 진심모드 / 지금 한다 or 하버 존버,많관부,메이플스토리 - 유저 커뮤니티,4주 전
"[월간 2023, 10월의 주제 : Oh Come To Our Best Endless Romance] 매력..있나?",# face # 많관부 댓글모두보기 j.m 응원이야 욕이야? | dldujuu__ thv 지민아 옷 여며 | j.m 여밀 옷이 없어 | dldujuu__ 그럼 입어 | j.m 사줄래? | thv ️ | dldujuu__ ️ | j.m 참된 우정에 눈물이 난다. [HOT] ㅇㅇㅈ랑 ㅂㅈㅁ 제발 사겼으면 좋겠다. 아 제발 진짜 넘 잘어울림 ㅠ 제발...,별은 떨어졌어 나에겐 빛은 없어,4주 전
10월의 어느 멋진 날에라고 하면 진부하니 10어멋날이라 제목을 지은 건에 대하여,있으니 많관부 부탁해 특히 그어살 3~4시간 걸림 적는데 좌.. e렇게 10월달 blog가 끝나게 됩니다.. 요즘 i am 신뢰? 유행같이 보이는데 무슨 밈인진 몰라서 쓰지 않도록 하겠슴다 날씨도 많이 쌀쌀해지는데 감기 따위에 무너지지 않게 옷 단디 입고 댕기고 이런시기에 영화를...,박신영의 필모그래피,4주 전
중꺾마 : 중요한 건 꺾이는 마음,ㄹㅇ 프듀40 찍는 줄 그래도 생각보다 잘해서 기분좋게 집 갔습니다 배라 큰 거 온다 도라에몽이랑 콜라보한다 쇼핑백을 위해 파인트 구매하도록 하겠습니다 저는 신메뉴도 맛있겠더라 많관부 아 참고로 내일 대전가는데 계획을 하나도 안 짬 집가는 길 간식 챙기며...,Do what makes you happy,4주 전
13차 기부 온라인 플리마켓 오늘밤 11시 20분에 댓글창 열게요! (수익금의 100% 기부),6. 반드시 내일 오전10시까지 입금주세요 혹시나 미입금분이 있다면 내일 그것들만 모아 재판매할게요! 7. 배송비 3천원 별도 두근두근!!!!!!! 누가 이 물품의 주인이 될 것인가...!!!!! 수익금 100% 기부가 되니 많관부! (많은관심부탁드려요!),"미싱장인의 딸래미,미싱꾼아내의 빛나는 소잉블로그",4주 전
10.31 (우와 10월끝!!),이주영 어케 다시 16년으로 돌아갔냐 히익 퇴근하고 돌아온 집에서 하투 머리끈 보고 기분 올라가기 푸른밤 옥상달빛입니다 보이는라디오 보기 내일 녹야 개봉 많관부!!!! 인생은 정말 쉽지않다 원래 내일 쉬는날이었는데 바껴서 퇴근 하자마자 20분 안에 용산 아팍 도착해서...,1인분의 삶,4주 전
I am 신뢰에요,제발 많관부 라고 임시저장해놨는데 8개 더 팔림 아싸 오빠 소원대로 이불 교체 여름 이불은 세탁기에 넣으라니까 이불 위에 있던 내... 마무리 갈 땐 가더라도 갈비에 1인 1냉면 먹어주고 커피에 1인 1빵까지 먹어줘야 진짜 끝 뭔 한 달이 먹다가 끝나네 Next time에도 ~,마름이네,4주 전
23년 10월 일상 (3),심지어 카메라는 다 담아내지도 못하는 정말 아름다운 풍경이었다 내가 지금까지 본 별들 중에 제일 많았다 일출 보고서 그 유명한 황매산 억새까지 원없이 봤다 황매산은 이야기 할게 많아서 등산 포스팅에서 자세히 풀어볼께용...ㅎ 10월 셋째주 일상 끝~~!,쯔리로그 :D,4주 전
#10월,"좋다 지루했던 삶이 조금은 회복된거같은,,,ㅎ 이번달은 보니까 친구를 못만났네,, 중간고사와 일을 병행하기란,,, 조금 힘들어서 눈물나는 정도 아무도 말 안걸었으면. 이제 좀더 힘들어질 예정 누가 말려 많이 놀러댕기는건 아니지만 예예의 소소한 일상 ~,~",yumyum yelog,4주 전
아낌없이 주는 나무,이지해 진짜 미안함 응 지해야 미안한데 팩트 인정해라 근데 진짜 유감 (묶는걸 못하는데 유리화는 또 잘함 이지해도 비정상임) 이제 졸업이 얼마 남지 않았으니 본격적으로 한울라이프 기록할겁니다 다들 많관부 7시50분 등교 시도! 오늘은 구기대회 때를 추억하며...,바게빈의 세계 정복,4주 전
"10월에 진짜 재밌는 일이 생겨버렸다,,,","사진 왕창 찍어 올게유 그때 많관부~~~~ 오! 또알기~?! 귀엽게 잘 만들었넹ㅋㅋㅋㅋㅋ 하마터면 따 먹을 뻔~ 응? 설마 내가 아는 다람이,,,? 동공 좀만 키워 주지야,,, 기괴하네 설마 저 위에 털은 속눈썹임?? ㅋㅋㅋㅋㅋㅋㅋㅋㅋㅋㅋㅋㅋㅋㅋ ㅋㅋㅋㅋㅋㅋㅋㅋㅋㅋㅋㅋㅋㅋ...",( ⸝⸝•ᴗ•⸝⸝ )੭⁾⁾,4주 전
2023.10,"모티프 많관부 ,, #모티프 밤 아홉시에 할머니 집 오자마자 숙제하는 초등학생 학구열 멋있는데 ,,, 12시에 딱 저거 보고 잠 나 오늘 결혼해 ?? 세수하고 리프팅팩 ? 하고 집으로 출발 ,, 아 근데 이거 귀가 너무 아파서 3-4시간 해야된다는데 못채움 그래도 2시간 정도는 했다...",SoSo한 B_log :),4주 전
나련언젠가쓰일 슈쉴유배엉릐 많관부,레이디버그헬멧과 어울릴예정,모두의마블 모바일 for kakao,4주 전
아주 지나간 어느 장면 속에서,많관부많관부 1화 후기: 후미야는 갈수록 연기가 느네... 마구쓰다듬어주고싶음 그리고 시손 역할은... 죄송한데 너무 그뭔씹 같아서 항마력 떨어져요 특히 『도죠.』 할 때마다 진짜 육성으로 제발!!!!! 외침 요리드라마면서 1화 내내 나폴리탄만 만들고 앉아있길래 뭐 얼마나...,littlemashedpotato,4주 전
언니야 모자가 작구나. +) 10월 모음집,고서커피 소금빵 진짜 ㅈㄴ맛있더라구요 하… 담엔 샌드위치를 먹어야겠어 개쩌는 케이팝 신 이태민 10월 30일 컴백 많관부 #10_18 햄부기부기부기부기 제 원픽은 쿼파치입니다 갠적으로 2천원만 받으면 좋겠어요 개비싸 미친놈이 저녁엔 아주 오랜만에 희지와 은서를...,✨❤️,4주 전
뭔 벌써 10월이 끝나니,차린 건 없지만 많관부 .. 이응두 생일이었다! 보고싶다! 입에 침은 바르고 얘기해 유병재 프레임을 어케 참니? 너무 피곤한 걸요 …… 본격 김민주 개까이는 일상 1 2 3 … 쏘영아 … 언니랑두 포켓몬 얘기하쟈 금요일마다 거하게 먹네요 잼민이들아 뭐하니? 코딱지 이제...,; castropollux,4주 전
DAILY ) 수원 '글래비티 클라이밍' / 수원 행궁동 카페 '홍라드' / 나혜석 거리 맛집 '미미화로' & '금별맥주...,"했는데,, 고량주가 눈 앞에 있네요,, 에휴,, 딱 3잔만 먹어줬습니다..ㅎ (뒤 샤인은 우리집 대호네 농장 샤인 많관부) 달이 엄청 밝고 동글동글 토끼가 방아 찧는 것도 보일라나 몰라~~ 언니 ~ 앞에 귀신 있는데...? ㅋㅋㅋㅋㅋㅋㅋㅋㅋㅋㅋㅋㅋ 다들 달 보며 소원이나 빌고 가쇼",호씨네 세상 ✨️,4주 전
오뱅알~,역시 대협.. 갑자기 튀어나오는 괴물들에 전혀 안 놀라시고 오히려 불쌍하다고 하시는군요. 갑툭튀가 많다길래 저는 진작에 쫄았었는데 대협 덕분에(?) 안 무서웠습니다. 노가리도 재밌었고~ 뽀짝혁도 출시!(많관부) 오늘도 오뱅알입니다~,창천객잔,4주 전
강아지 간식 추천: 노즈워크간식 견우직냥 고고단트릿 4종 (feat. 공동구매 예정),"트릿의 크기가 작고 건강에도 좋은데 너무 맛있게 잘 먹는 모습을 보면 줘도~줘도~ 계속 주고 싶어져요 ㅎㅎ 영양만점 건강간식, 강아지간식 ""견우직냥 고고단트릿"" 잇님들께 추천드리며 꼬미X고고단트릿 공구 많관부 제품 구매 & 이용 링크 11월 2일 ~ 11월 5일 고고단트릿...",elly daily❤,4주 전
10-2 경표를 만났어요,안녕하시와요 5월쯤에 운동 시작해서 현재 15kg 뺀 저 대단해요 이번년 안에 몸무게 앞자리가 두번 바뀌는 기적을 보여드릴게요 많관부 귀요워서 (๑>◡<๑) 일운동집 만 반복하던 삶을 살다가 여러 사람 만나며 재미보다가 저한테도 복이 왔나보아요 영현이 후로는...,(΄◉◞౪◟◉｀),4주 전
Oct.,https://ppin77.cafe24.com/product/detail.html?product_no=71 3일까지니까 다들 많관부‼️ 다시 학교 와서 연습티비... 나 좀 기여운데? 모자는 오빠 바지 자른 거.. 인앤아웃 모자 생각남 이건 센나키 바지 자른 거... 진짜 모델 같당.. 무서움...,Yoo Archive,4주 전
What's your preference?,이웃님들한테 제일 먼저 공유 하고 싶어서 소심하게 스포 하고 갑니다.. 아직 아무것도 없지만 곧 하나씩 채워갈테니 팔로우 해주시고 정말정말 very soon! 채찍질도 마니 해주시고요.. 오지랖 참견 환영입니다..많관부.. 하트..,Everything happens for a reason,4주 전
23.10,7 2주만에 나온 박상병과 또 행궁 〰️ 행궁 넘어가자마자 토리코에서 라멘 먹었다 이번 달부터 어디 맛있는 곳이나 재미난 곳 방문하면 따로 체크인 블챌에 올릴 거니까 많관부 토리코 방문기 아무튼 다 먹고 슬슬 갈 준비 하려는데 박상병이 이렇게 접시를 열심히 닦는...,진심,4주 전
10월의 이것저것,(팩쳌팩쳌 많관부 많관부) 1시에 노래 나온다고 해서 교실 컴퓨터로 보려고 했는데 3시로 미뤄짐 에셈 일 안 하냐!!! 그래서 쉬는 시간에 조현서랑 봤지요 10/7 캠핑 진짜 한 2~3년 만에 오는 듯 엄마아빠 텐트 치는 동안 동생이랑 자전거 타러 감 자전거 타다 피 봤다 넘어지는...,MY STORY,4주 전
(인스타그램)가수님인스타그램,이해한다는 말 Understanding 3. 쓰여진 편지 위로 Written Letter 4. 그대와 함께 Together 5. 5분 전 5 Minutes #5집미니앨범 #gift #기프트 #선물 #나의봄날 #이혼해요 #많관부 #잊을수록지울수록지날수록#황치열#기적같은날만오길#,치열스 황치열팬카페(Hwang Chiyeul Fan Cafe),4주 전
10월 넷째주 일상 :: 나를 위로하던 누군가의 음악도 뚝딱 나온게 아닐것임을 깨닫고,"한소희 블로그 차용으로 시마이 치겠습니당 아 참, , , , 내년 계획이 맛집블로거라 슬금슬금 시작해볼려고 블로그 하나 새로 팠습니당 맛집 인플루언서 될거니까 미리 성지순례하십셔ㅎㅎ 많관부 https://blog.naver.com/mapo_romantic_cat",별일 없이 산다,4주 전
"(도쿄 4박 5일 실전) - ""Day2"" (요시노야 조식, 도쿄 디즈니랜드, 도쿄역 돈가스, 마루노우치 프렌치토스트...","https://blog.naver.com/beckynbeige/223237062059 """" 혹시나 궁금하실 수도 있으니 요시노야 링크 있는 글 투머치 되지 않도록 딱 한개만 올릴게여~많관부₩☺️❤️히히히>< 요시노야 핫초보리점은 7:00 오픈입니당,, 그래서 6:50에 가서 오픈런을 하려고 했으나,, 우리나라는 종종 그...",Becky&Beige,4주 전
10월에는 놀고 먹었습니다,강콩순 인슷하 개설 했습니다 ~ 다들 많관부 ㅋ 콘수니.. 중성화했숩니다ㅠ 마취 안깨고 계속 돌아다니길래 왜이러나하고 안아줬더니 바로 잠.. 조금만 고생하자ㅠ 아푸지마 영화가 보고싶어서 시간 되는 걸로 봤는데 존잼…… 내 웃음코드랑 잘 맞아서 나 혼자 웃으면서...,블로그명은 강민지입니다.,4주 전
품절 대란 디올 블러셔 212 튀튀 일본에서 득템! 쿨톤 핑크 인 줄 알았는데 봄 웜한테도 찰떡이잖아?,진짜 색상만큼 사랑스러운 이름이다. 여행 첫날 기분 좋은 소비로 시작하니 여행도 술술 풀리는 기분이었고 또 그러했다 아침마다 화장하는 내내 튀튀 올릴 때마다 기분이가 좋았으니깐♥ 이제 일본 4박 5일 여행을 포스팅해 보겠다! ♡,오ꕤ혜피데이ˊ˗ Life 로그-in♥,4주 전
도라에몽 암기빵 내놔,ㅋㅋㅋㅋㅋㅋㅋ 아니 내가 좋아하는 먹방 유튜버인데 2년 전 영상 보다가 발견 ㅋㅋㅋㅋㅋ ㄱㅇㄱ 여러분 #엽동 많관부 •• ㄹㅇ 짱 맛있게 드심 햄지님이랑 투탑;; 근데 이때까지 안 잔 거 ㄹㅈㄷ... 8시에 잠들었다가 12시 반에 일어났다요... 요즘 잠이 잘 안 오고 자주...,Ara's Blog :),4주 전
"사랑하기 위한 삶,살기 위해 한 사랑",이번 블로그 제목은 루시의 아지랑이 가사임니댜 ♥ 많관부:> 1002 오랜만?은 아니고 마라탕 먹으러 김건아와 원예언을 만났어요! 저는 오늘두 볶음밥을 먹습니댜. 볶음밥 냠… 그리고 저녁엔 이서현과 만났습니댜. 오늘도 열심히 산책! ♥ 사진도 찍어줍니댜ㅋㅋ 기엽됴?...,묭,4주 전
갓생이라기엔 민망한 쩝쩝박사의 10월,걸어가는 길에 셋이서 화음 넣으면서 노래 부르고 그랬음 그래서 결성한 “화이트걸스” 크리스마스 쯤에 데뷔하기로 했음 많관부 1002 나으 술찌와 아덜램 예주니ㅎㅎ 최애조합!!! 내가 사랑하는 이들과 함께 또 재미난 술자리 가졌어요 히히 진짜 너무 편안하고...,대충 열심히 살기ㅇㅅㅇ,4주 전
열심히 살았다고 자부할 수 있나요,이육사문학관 많관부 이거 왜 찍얶지 나 손뻗고 있는거 어이없음ㅠㅠ 밥먹기 전에 개큰이슈 개큰웃음 우리 다 도망가고 정현이만 하하..하하..아니에요..하하 밥먹구 아이스크림 먹었어요 어디 올라가서 여유롭게 먹고있었는데 사람들 몰려와서 바로 피함 힉힉호모리 모임...,recording shop,4주 전
뜨끈한 갈비곰탕 든든하게 먹고온 후기_익산 영등동 금천곰탕,듬뿍 올려서 진하게 우려낸 만큼 하얗고 뽀얀 곰탕국물에 푸욱 적셔먹으니 일품입니당 가장 맛있게 먹었던 마늘쫑 장아찌와 조합 추천해요! 포장 판매도 하니 많관부 오늘도 잘 먹었습니다아~ #익산맛집 #영등동맛집 #익산곰탕 #익산갈비곰탕 #익산꼬리곰탕 #익산곰탕맛집,Eating up Guide,4주 전
병점속눈썹펌 추천 온아이래쉬,다들 많관부 자 그럼 이제 대망의 비포 애프터 사진 나갑니다 . . . . . 짜란 왼쪽이 비포 오른쪽이 에프터 무쌍인 눈이라 펌만 받아도 변화무쌍 나는 여행가기전에 딱 예쁘게 펌을 받아서 기분이 너무 좋았고 엄마는 어색한지 이번 한번만 하는걸로 만족했다는 후문ㅋㅋ...,bari_kangyu,4주 전
라라별찌 공방장의 감사한 마음이 남은 31일간의 추억,ㅎㅎ 많관부에요 출강이 끝나며눙 오빠랑 함께하는 절거운 저녁시간 ㅋㅋㅋㅋ 맛집이라고 찾아온 라멘집 기특해 알로에 스냅 촬영 샘플도 만들고 경험도 쌓아가는중 ㅎㅎ 여러분의 소중한 시간을 예쁘게 담아드리려고 노력중입니댕 ㅎㅎㅎ 참 조향사 자격증도 무사히...,LALABYULZZI SCENT ATELIER,4주 전
23.10,이번 성탄도 많관부 10월 11일 잉? 시험이라고? 이게 맞아? 왜? 시험이야? 난 기말을 준비하기로 했지만 너희들은 시험 다 잘 치고 와라 10월 12일 시험 2일차 사망 10월 13일 시험 마지막 날!!!!!!! 모든 것을 다 내려놓고 기말을 준비한다.. 시험 끝날 때마다 다짐하는 거지만...,서현,4주 전
생각해봐 우린 소음마저 음악이야 저마다의 쿵짝 맞춰가며 살아가,신 많관부 어머 진짜 가을이야 난 이맘때만 되면 남이섬에 가고싶어서 미치겠어 늦기 전에 가야하는데 항상 이러다 놓치지만 ㄱ- 내년 가을엔 갈 수 있을랑가 귀엽다 귀여워 안경이 아니라 하트입니다 10월 27일 퇴근하고 은지선샌미랑 지원선샌미랑 저녁 먹었다 돈가스에...,archive,4주 전
신림역 더클라임 클라이밍 짐앤샵 신림점 내돈내산 솔직후기,많으신분들 많관부~~~~ 영상 폼 미쳤죠.. 영상들은 더클라임 신림점은 아니지만 다른 암장 곳곳에서 찍은영상이에요! 어느새 검은색까지 정복하고 있는 그녀.. 클라이밍 좋아하시는 분들은 주로 인스타그램으로 소통한다고 들었어요! https://instagram.com/climbing._.jisu?igshid...,인스타툰 그리는 엘라의 사생활,4주 전
웨이팅 간호사는 뭐할까요?,많관부❣️) 사실 퇴사하자마자 그새를 못참고 지원했는데 합격했어요 오아와아ㅏㅏㅏㅏㅏㅏ 7월부터 나오라길래 .......? 계속 입사를 미루고 있어요ㅋㅋㅋㅋㅋㅋㅋ (끼꿍이는 다리 때문에 당장은 걷고 뛰고 힘듬ㅠㅠ) 벌써 5개월이나 눈누난나 하네요? 보통은 여행을...,끼꿍이,4주 전
2023年 10月,많관부 ♀️ 이 모든 걸 하또바에서 먹었다면 믿겠습니까? 맛없없 = 맛 없는 게 없다 양림동 가면 무조건 하또바 가세요 후회 안 합니다 2차로 미드나잇 와서 푸파하긔 경주헴 HBD 흐릿해도 폭룡적인 귀여움은 숨길 수 없다 퇴근 후 엄마랑 먹고 싶었던 칼국수와 팥죽 먹긔...,365247,4주 전
어덕행덕 덕질일기. 세븐틴 앨범 SEVENTEENTH HEAVEN CARAT Ver. 바인더 드볼 앨깡,"(윤정한이 15장나와서요...) ++++ 아, 포스팅하다보니 포카 하자가 있었어요. 케이타운포유는 언박싱영상까지 보내래요... 여러분 예스24에서 사세요....ㅎㅎㅎㅎ 끝. 세븐틴 11집 미니앨범 SVENTEENTH HEAVEN 타이틀 곡 "" 음악의 신 "" ! 쿵치팍치 쿵치팍치 예-!!!!!",S U N N Y D A Y _ ♥,4주 전
10월이라 그래,재균 창주를 만났네요 굿 아 무인도의 디바 많관부 드디어 테레비에 이름 넣었네요 잘 찾아보시길! 경크 회식에서 찍은 한소희 님 사진을 저번 일기에 올렸는데요 돌고돌아 그사진이 한소희 님 블로그에 올라왔어요 저 네임팬도 제겁니다 아 출처 남길걸...ㅜㅜ 영광... 성덕....,오늘은 이렇게 살았습니다,4주 전
내가 보려고 만든 KBL 선수 모음집,별별 콘텐츠를 다 찍었는지 알 수있다 그래서 어느 팀을 응원하더라도 타팀 선수 하나하나 다 기억하게 되고 다 잘됐으면 하는 마음 그래서 준비한 크블 선수들의 한농위 모음 (내 개그맨 김낙현 분량 많음ㅋㅋㅋㅋ) 다들 KBL 크블 지금 한창 23-24 시즌중! #KBL #크블 #선수,"Peach, Plum, Pear",4주 전
