제목,내용,게시자,게시날짜
막스마라 뽀글이 쇼퍼백 특가 / 모포 10만대,이로 인하여 반품/교환은 불가하기에 이 점 참고 해 주세요. 로마셀럽 11월 이벤트! 구매 하신 분들께 랜덤 선물 예정 ✍구매 후 후기 남겨주시면 다음달 당첨 이벤트 확률 UP! 많은 참여 부탁드려요 ♀️ 매월 1일 로마셀러 이벤트 https://cafe.naver.com/ttoksun2/5914072,어스맘 〔명품 구매대행〕,1일 전
"참 기분 좋은 상...송중기·김선호·박보영·조인성, 청정원 인기스타상 공동 수상 소감 [청룡영화상]",#송중기 #김선호 #박보영 #조인성 #청정원인기스타상 #제44회청룡영화상 #여의도KBS홀 #케이트렌디뉴스 #ktrendynews #ktntv #네이버 #실시간뉴스 #많관부 #김혜수 #유연석 #한국영화 #인기배우 #영화상시상식 #배우수상 #문화행사 #엔터테인먼트뉴스 #영화제...,26feb님의 블로그,1일 전
2023.10.07~10.10 홋카이도,들으시고 여권 보여주니 조회하고 임시 표 끊어주심… 감사합니다… 진짜…. 근데 엄마도 아이패드 심사장에 놓고와서 결국 나도 엄마 갈구고 사이좋게 비행기 탑승함 힘들었다… 일본… 홋카이도… 헤헤헤 첫 기록을 여행으로 시작하니까 뭔가 이완용 느낌임 무튼 ..,처음부터 잘하면 외계인,1일 전
이거 안올렸었네요. 많관부,찰리 3통 40렙!,리버스: 1999 공식 카페,1일 전
"전여빈, 중꺾그마 신조어 감동적인 수상 소감으로 여우조연상의 영예 안아 [청룡영화상]","배우 김혜수와 유연석의 사회로 화려하게 진행되었으며, 전여빈은 김선영, 이윤지, 정수정, 한선화와의 경합 끝에 여우조연상을 차지했다. #전여빈 #거미집 #청룡영화상 #여우조연상 #수상소감 #케이트렌디뉴스 #ktrendynews #ktntv #네이버 #실시간뉴스 #많관부 #김혜수",26feb님의 블로그,1일 전
오늘 23-24시 술테랑 모집 (마감),"술테랑 - 음주+프세카하기 조건: 술 사진 인증 필수 / 성인이여야함 참여하실 성인분 모집합니다! 참여율이 저조하면 앞으로 열릴 기회는 없을거 같습니다,, 즐겁게 협라해요 / 폭사하셔도 ㄱㅊ (어차피 다들 폭사하고 있을거니까요 ㅎㅎ) 마... 미방",프로젝트 세카이 컬러풀 스테이지! feat.하츠네 미쿠 공식카페,1일 전
"정유미, 고백 10년 전 미스 김서 김혜수 안 만났으면... 여우주연상 수상 소감 [청룡영화상]",#정유미 #잠 #청룡영화상 #여우주연상 #김혜수 #유연석 #영등포구KBS홀 #케이트렌디뉴스 #ktrendynews #ktntv #네이버 #실시간뉴스 #많관부 #한국영화 #영화상시상식 #배우수상 #문화행사 #엔터테인먼트뉴스 #영화제 #시상식하이라이트 #영화계축하,26feb님의 블로그,1일 전
"정유미, 고백 10년 전 미스 김서 김혜수 안 만났으면... 여우주연상 수상 소감 [청룡영화상]",""" =#청룡영화상 #정유미 #여우주연상 #케이트렌디뉴스 #ktrendynews #ktntv #네이버 #실시간뉴스 #많관부 #배우 #영화계= #한국문화",26feb님의 블로그,1일 전
"[KtN 포토] 탕웨이, 대륙 여신의 유쾌한 손하트",=#청룡영화상 #탕웨이 #케이트렌디뉴스 #ktrendynews #ktntv #네이버 #실시간뉴스 #많관부 #배우 #감동적이별 #영화계축하 #한국문화,26feb님의 블로그,1일 전
김혜수가 다살린거야...박진영 무대 보는 배우들 표정 와글와글 [청룡영화상],""" "" #김혜수 #청룡영화상 #박진영 #박진영무대 #배우들표정 #축하무대 #여의도KBS홀 #영화상시상식 #류준열 #송중기 #김선영 #수지 #이상민 #케이트렌디뉴스 #ktrendynews #ktntv #네이버 #실시간뉴스 #많관부 #배우 #감동적이별 #영화계축하 #한국문화",26feb님의 블로그,1일 전
막스마라 여성 캐시미어 터틀넥 니트 베스트 / 모포가 10만대,로마셀럽 11월 이벤트! 구매 하신 분들께 랜덤 선물 예정 ✍구매 후 후기 남겨주시면 다음달 당첨 이벤트 확률 UP! 많은 참여 부탁드려요 ♀️ 매월 1일 로마셀러 이벤트 많관부 https://cafe.naver.com/ttoksun2/5914072,어스맘 〔명품 구매대행〕,1일 전
100문 100답,내가 하는 SNS 블로그 많관부 60. 애인 유무 無 61. 연말에 하고 싶은 일 집 밖에 나가기 근데 혼자서는 어려워서 누가 끌고 나가줘야함 62. 돈 생기면 가장 많이 쓰는 곳 밥 말고는 쓸 일이 없어 63. 죽을 때 유언으로 하고 싶은 말 하고 싶은 말이 너무너무 많아서 죽을...,에엥,1일 전
광진구 구의동 구의역 맛집 삼겹살 목살 신상맛집 고기는 구이역,귀여운 리뷰이벤트도 진행중 많관부=3 네이버예약으로 예약하고 갔더니 이렇게나 예쁘게 셋팅이 되어있었다능!!!! 입안을 개운하게 해주는 밑반찬 총출동이요~ 저 상추랑 깻잎 들어가있는 그릇 넘 특이했다ㅋㅋㅋ 때깔고운 돼지 목살과 귀여운 새송이버섯 나오셨어요 내가...,야무지게 사니로그,1일 전
[신청마감] [공유=] 달의 하루 - 『순혈주의자』 서이구글 모집,올라가게 되면 댓글로 신청자분들 소환할거기 때문에 물어보는겁니다~! 소환이 필요없으시면 그냥 X 치시면 돼요~! 그면 많관부입니다 마지막으로 이 글은 서이구글 게시글이 아닌 모집글임을 다시 한번 밝힙니다. #순혈주의자 #달의하루 #서이구글 #단체서이구글 #모집,0412,1일 전
[FKI 메타버스 서포터즈 B조] 기업가정신 2주차 활동,"그러니 이번 2주차 게시물에 대해서도 많관부ㅎㅎㅎ(많은 관심 부탁!이라는 뜻) 이번 2주차 강의는 기업가, 그 중에서도 기업가 정신에 대해서 알아보는 시간이었는데요! 기업가 정신이라는 단어는 평소에 잘 쓰지 않고, 경영학과 3년을 다니면서도 크게 강조된 부분은...",주호,1일 전
잠시 후 8PM부터 라이브 방송!,빌딩앤 파이터 라이브 많관부!,쵸단 팬카페 [쵸만봐],1일 전
"벤츠 C클래스 중고 2020년식 27,988km C200 쿠페 주행 편리한 수입차","3,780만원 색 상 : 흰색 연 료 : 휘발유 변 속 기 : 오토 차량번호 : 상세이미지 참조 사고유무 : 무사고 옵 션 : 네비게이션,블랙박스,감지센서 전방,감지센서 후방 기타사항 : 무사고 키2개 센터관리 차상태그림 스치면계약 문의전화 : ***-****-****",★첫차중고차★허위없는 실매물 중고차★,1일 전
"벤츠 E클래스 중고 2021년식 62,614km E450 4MATIC 익스클루시브 럭셔리한 우아함 뽐내는차","연 료 : 휘발유 변 속 기 : 오토 차량번호 : 상세이미지 참조 사고유무 : 무사고 옵 션 : 에어컨,핸들리모컨,스마트키,블랙박스,4륜구동,HUD 헤드 업 디스플레이 기타사항 : 완전무사고 센터관리 차상태그림 스치면계약 많관부 문의전화 : ***-****-****",●SKV중고차● 중고차 수원중고차 중고차매매 수입 국산 자동차,1일 전
유튜브 영상 업로드 했습니당!!,히히 많관부 https://youtube.com/watch?v=VAWFpvHreMs&si=ixhY_mQNvBVCgC9v,해치마을 방앗간,1일 전
히든지니어스 시즌 2 결승전 결과,현무유나의 정체를 밝히기전 바로 우승자를 발표 국룰 우승자는 광고보고 발표 ㅋㅋㅋㅋ 후속작 언노운룰 리그도 많관부!!! 주절거리고 있지만 ㄹㅇ 술안먹었었다... ㄷㄱㄷㄱㄷㄱㄷㄱㄷㄱ ㄷㄱㄷㄱㄷㄱㄷㄱㄷㄱㄷㄱ 가장 유나일것같은 사람도 토론을 잘한사람도 모두...,스타 지니어스,1일 전
리퀘,"느낌 -여리여리 공주캐 -병약캐 불호 -날개날린 캐 -잼민캐 ""확인했습니다""라고 답글 달리면 당발일 까지 기다려주세요=͟͟͞͞Ꙭ̮ 당발은 오늘 저녁이나 일요일. 마찬가지로 1~3분 정도 그려드릴게요 많관부!! (취향캐가 일요일 까지 없으면 불발하겠습니다)",얼음땡 온라인 공식카페,1일 전
신림동백순대 전주익산 순대타운 맛집 택배 포장 미스터트롯 고정우 만남,넘넘 성실하심 + 11월 17일 희망티비에 나오신다고 하니 많관부! 신림동백순대는 매장이 많아서 어딜 가야할지 고민일 때가 많은데 3층에 있는 전주익산에 방문해서 단골이 되어보자 신림동 순대타운에서 제일 푸짐하고 맛있는 집! #신림동순대타운 #신림동백순대...,쫑알쫑알,4주 전
천사들과함께한10월입니다,그 시각 또 둘만 롯데월드 가는 저는요 저는 왜 안 껴주시나요 많관부 매주 목요일 밤 8시 유튜브 “오락실팡“ 많관부입니다.. 껄껄껄 제발 인생아 인간아 제발 만년에 한번 오는 옷 정리 시간... 백수는 옷을 팔아보고자하네요... 얼만큼 팔 수 있을지... 20kg가 넘을 수 있을지....,신도린역 붕어빵장수 예저씨,4주 전
2023 biff,구거도 먹고 ㅎㅎ 다음날 현실복귀 ㅅ발 꿈깨라. 네... 첫부국제 참 재미잇고 좋았습니다... 정말 꿈만 같았던 시간이네요 ㅠㅠㅠㅠ내년에도 갈래애애애애 글고 님들. 내일(11/1) 개봉하는 키리에의노래 괴물도 11/29에 개봉하니깐 다들보로가.....,Ooooo,4주 전
창원 곱창 맛집 곱이곱다 창원점 동네주민 찐 단골집 창원버스터미널맛집,곧 재방문 전골 후기 들고올게요 제 찐찐찐 단골 맛집이라서 아무도 안알려 주려했지만 큰맘 먹고 알려드립니다 ...^^ 12월 경 상남동 성산명가 근처로 이전한다고 하니 앞으로 많관부~ *이 글은 리뷰노트를 통하여 본업체에서 서비스 또는 제품을 제공받아 작성된...,:Da_ily_hye,4주 전
"[일본/오사카] 3박4일 여행 준비하기! | 항공권,숙소,도시락 와이파이,여행자 보험,트래블월렛,하루카열차",이렇게 편리한데 왜 준비안해…!!! 동전지갑 무겁게 들고다니면서 와르르 쏟지말고 미리미리 준비해요 우리! 일본 여행 준비시 가장 기본적으로 한국에서 준비해야할 것들을 준비해봤습니다! 이제 일본여행 포스팅 시작이니 다덜 ~~~,｡ﾟ°. ☾ * :･ﾟ✧° ｡* °｡˚✩,4주 전
“미래가 어떨지 모르지만 꿈을 포기하진 않을래”,약간 입덕부정기 겪고 있는?ㅋㅋㅌㅌㅌ 노래도 너무 좋으니깐 많관부! 이건 내용과 상관없는 냥이 10/31 제가 하고싶은게 생겼는데 이건 확실히 하게되는 그날에 알리도록 하겠뜹니다! 아마 다음달 블로그내용에 나와있지 않을까 예상을 해봅니댱 안나온다면...,박혠의 우당탕 일상,4주 전
여자탈모샴푸추천 저자극탈모샴푸 메디올두피청정샴푸2.0 지현우샴푸 개운해요,"개운함이 오래가는 메디올 코스맥스 두피 모발 연구소에서 개발한 고기능성 샴푸 온 가족이 사용할 수 있어 민감두피에도 딱이랍니다 :-) & 두피청정샴푸는 메디올 공식몰에서만 단독으로 구매가능하고, 첫구매 시 회원 7%할인과 최대 반값 이벤트도 진행하고 있으니 !",뷰티풀 핑구❣,4주 전
✅광안리맛집 일본음식 좋아하면 꼭 들려야하는 페이센동광안직영점의 맛집탐방,언제부터인가 맛집을 많이 다니게 되면서 제 살은 뿔었지만 그래도 맛집은 참을수 없잖아요*...* 많관부 ✌️✌️ 오늘의 맛집은 광안리맛집/수영구맛집을 알려드릴려고 한답니당 ! 광안리에 가실분들은 오늘의 맛집을 꼭 정독해주시기 바랍니닷 ✅가게 상호명 : 페이센동...,맛집탐방,4주 전
1031,성공했습니다 맛있어서 두캔 마심 원래 맥주 배불러서 한 캔도 다 못마시는데 ㅠ 이제 아침에 출근하는 일 없으니까 알람 다 지우고 푹 잘게요❤️ 오야스미 ㅇ ㅏ 맞다 오늘 나니와튜브 올라왔어요 https://youtu.be/6DosCWohjeQ?si=xqgCiJpBCB5Wjr60 양이랑 달리기하는 남성들,뭐할까?,4주 전
✅서귀포맛집 매일매일 반찬이 다른 바다어멍서귀포올레시장본점의 맛집탐방,언제부터인가 맛집을 많이 다니게 되면서 제 살은 뿔었지만 그래도 맛집은 참을수 없잖아요*...* 많관부 ✌️✌️ 오늘의 맛집은 서귀포올레시장맛집을 알려드릴려고 한답니당 ! 중문올레시장에 가실분들은 오늘의 맛집을 꼭 정독해주시기 바랍니닷 ✅가게 상호명...,맛집탐방,4주 전
내일의 우리,삼굽살 많관부 ️️ 일 하면서 놀건 다 놀면서 지내는데 수능 2주 남은 고삼 맞는가 싶습니다 최저 못 맞추면 글 다 내리고 한강 가겠습니다 기대하지마세요 글 쓸거 탕진해서 두부로 마무리 하겠습니다 쓸거 생기면 다시 쓰러 올게요 올해 얼마 안 남았으니 다들...,.,4주 전
마감: 비비안웨스트우드 유니섹스 로고 울 니트 조끼 / 데일리 니트 베스트!,로마셀럽 11월 이벤트! 구매 하신 분들께 랜덤 선물 예정 ✍구매 후 후기 남겨주시면 다음달 당첨 이벤트 확률 UP! 많은 참여 부탁드려요 ♀️ 매월 1일 로마셀러 이벤트 많관부 https://cafe.naver.com/ttoksun2/5914072?tc=shared_link,어스맘 〔명품 구매대행〕,4주 전
10月｜스탑 이름은 버려 미스터 악토버 악토버 악토버,피자먹고 오빠 만나러 홍천으로 가서 저걸 또 먹었어요 돼지가 따로없슴다 횟집아들이랑 만나는 나 개꿀 국물이 10사기 홍천 그래도 좋아회 많관부 ♥︎♥︎ 아 그니깐 왜 만났냐면 5주년이라서요 서울가서 놀기로 했는데 버스 예매도 안하고 걍 흘러가는대로 사는 p가...,입력중 ..,4주 전
10월의 어느 므찐 날,많관부 물불게임 아니..? 파이어보이 앤 워터걸인가 뭔가.. 죽기 싫어서 발버둥 오지게 쳤음ㅋㅎㅋㅎㅋㅎㅋㅎㅋㅎㅋㅋㅋㅋㅋ이거 아무리 생각해봐도 우정 파탄 게임 같아 예진이한테 손절 당할 뻔 처음으로 소품팀 + 조명팀 + 음향팀 + 배우팀들 전체 합 맞춰 본 날....,일상,4주 전
✅부산서면맛집 너무찐하지 않아서 좋은 라라관부산서면본점의 맛집탐방,언제부터인가 맛집을 많이 다니게 되면서 제 살은 뿔었지만 그래도 맛집은 참을수 없잖아요*...* 많관부 ✌️✌️ 오늘의 맛집은 부산서면맛집/부산맛집/서면맛집을 알려드릴려고 한답니당 ! 부산서면쪽에 가실분들은 오늘의 맛집을 꼭 정독해주시기 바랍니닷 ✅가게...,맛집탐방,4주 전
[인디펍] 도서언박싱,맹인의 거울 _정무 Junger Schnaps 융어 슈납스 _류연진 빨갛기엔 너무 퍼렜던 날들 _강도화 선택은 망설이다 _임발 총 이렇게 4권을 선택했고 앞으로 차차 책 관련 글을 올릴 예정이니 많관부요! . . . 책 고를 때 선택지도 다양하고 다 너무 재미있을 것 같아서 엄청...,blogxux,4주 전
오늘은 효소브이✌️ 공구 11/1 - 11/5,시간이 많으신 분 ✔️ 더부룩 배출하지 못해 답답함을 느끼시는 분 ✔️ 아침마다 얼굴 및 손발이 부으시는 분 저도 몇가지 해당사항이 되어서 먹기 시작했답니다 수납도 편리하고 이지컷으로 뜯기도 쉽고 완전 강추템 다들 〰️〰️〰️〰️ ☑️ 구매하기 ☑️,뇽뇽‘S 월드,4주 전
10,그리고 포토이즘 선글라스 도둑 빌런 ??: 카레카레 나의 다이애나 채현이가…… 여기저기서 보이는 우리의 스타들 불어전공 학술제 많관부~✨ 2 3~~~ 서경대 현관 수빈아 그래도 오빤데… 무릎 꿇리고 사진 찍는건 아니지.. 와… 보소…. … 케챱빌런 박X영 군 뮤지컬 틀고...,!,4주 전
2023년 10월,맴돌아 많관부 아침으로 피자먹구 점심엔 떡볶이 시켜묵기~~~ 나도 한 결정장애 해서 뭐먹지 하면 맨날 도망갔는데 그러다가 못시켜먹거나 하게되는경우가 있어서 걍 일단 질러봄 뭐먹을까~? 하자마자 떡볶이요! 해서 응떡시캬묵음 헤헤 수쌤이 사쥬심 응떡로제 맛잇져!??!?!...,마음껏 좋아하기,4주 전
✅두정동맛집 육즙감칠맛 전부 갖춘 동두천솥뚜껑삼겹살 두정점의 맛집탐방,언제부터인가 맛집을 많이 다니게 되면서 제 살은 뿔었지만 그래도 맛집은 참을수 없잖아요*...* 많관부 ✌️✌️ 오늘의 맛집은 두정동맛집/천안맛집을 알려드릴려고 한답니당 ! 두정동에 가실분들은 오늘의 맛집을 꼭 정독해주시기 바랍니닷 ✅가게 상호명...,맛집탐방,4주 전
"혼례대첩 2화 리뷰 : 나 서방님 보고 싶다, 줄거리, 로운X조이현, 3화 예고","과연 두 사람은 어떻게 세 딸들을 혼인시킬지, 순덕과 정우는 어떻게 인연이 될지 많관부! 혼례대첩 3화 예고 본격적으로 혼사를 성사키기 위해 움직이는 순덕(조이현)과 정우(로운) 하지만 일은 그리 순조롭게 돌아가지 않는다. 과연 이 두사람은 이 난관을 어떻게...",초코칩,4주 전
수완지구 신상맛집 후토마키 에비산도 점심 저녁 밥집 추천해요 광주신가동 후토마켓,"다들 많관부 후토마켓은 후토마키와 키토 전문점이라 일반인들 점심식사 , 저녁식사로도 추천하기도 하지만 특히나 다이어터들에게도 추천 해요 이제 다이어트도 맛있게 하자구요 ㅎㅎ 샐러드마키 7,900 치킨텐더와 여러가지 야채를 한곳에 모아 다이어트도 되면서...",구워리 블록,4주 전
✅안성맛집 서비스가 혜자인 낙원갈비집 안성점의 맛집탐방,언제부터인가 맛집을 많이 다니게 되면서 제 살은 뿔었지만 그래도 맛집은 참을수 없잖아요*...* 많관부 ✌️✌️ 오늘의 맛집은 안성맛집을 알려드릴려고 한답니당 ! 경기도안성쪽에 가실분들은 오늘의 맛집을 꼭 정독해주시기 바랍니닷 ✅가게 상호명 : 낙원갈비집...,맛집탐방,4주 전
"복대동속눈썹펌 ,11월11일까지만하는 한정이벤트챙기세요",이번 깜짝이벤트는 11월 11일까지만 하는 한정이벤트에요! 수분영양뷰러펌하시는 분들께 블랙틴팅코팅을 서비스로!!! 정말 ~! 큰맘먹고 하는 이벤트이오니 많관부 #청주속눈썹펌 #청주속눈썹 #복대동속눈썹 #복대동속눈썹펌 #가경동속눈썹 #가경동속눈썹펌,투브로우즈복대점,4주 전
일상 : 10月_2 날마다 새로울 순 없어도 깊어지기,10월 빅 이벤트 보라카이 다녀옴 #미리보기 궁금하신 분들 더많은 보라카이사진이 궁금하신 분들 일단 이 일상글 읽으시고 ㅎㅎ 보라카이 글 기대 부탁드립니다 ㅎ 많관부 그래도 10월이 좋은 이유? 니트를 잔뜩 입을 수 있다 정쥬가 선물해준 휘뚤마뚤 니트집업 꼬북칩과...,Molly Day,4주 전
뿡,"잘했지 많관부 딱 하나있는 핏줄 울 언냐가 하는 쇼핑몰인데 한번씩 촬영 도와주러 다니는 중 •• 총총 ,, 이 날도 세시간 넘게 촬영했으니 한번 다녀오면 녹초가 되어버림 첨에 스포짤 보고 옷 색깔이 너무 예뻐서 찜 해놨는데 실물 보자마자 바로 구매함 얘기 나온 김에...",i,4주 전
?,하지만 할 말이 너무 많았어요 ㅋㅋㅋ 둘 다 할 얘기 쌓아 뒀다가 와랄라랄라 얘기 함 ㅋㅋㅋ 이제 ~ 묘정님에 연애를 기원하면서 여기서 끗 할거예요 제 tmi블로그 읽어줘서 감사하고 앞으로도 많관부 ~(⁎⁍̴̆Ɛ⁍̴̆⁎) 생각해 보니 오늘 할로윈이네욘 사탕 줘 +인생이 쓴...,⠀,4주 전
똥컨인데 아델 라라 뭐가 더 ㄱㅊ?,많관부 . ..,메이플스토리 - 유저 커뮤니티,4주 전
23 oct,— 폴랑 — 이쁜옷 왕왕많으니까 많관부 멋진리뷰남기기위해 열심히 찍어봤는데 아 요거 쉽지않네 ㅎㅎㅎ.. 전공 잘보고싶어서 벼락치기 발악해봤어요 벌써 3년째 미리미리!를 다짐했는데 이것도 쉽지않네ㅎ 다시 본가로 컴백- 할아버지가 가족들 모아주셔서 오랜만에...,"For today ,",4주 전
22차) 그무 열어보아용~~,새로운 그림체? 로 돌아왔어용 ♡ 이런식으로 나가용~~ 스티커/굿즈 제작 가능 상업적 이용금지 <조건> -일반회원 이상 -짧게라도 후기 남겨주실분 -글 정독해주실분 <양식> -아가이름 -아가사진 -그림 사용할곳 예) 소장용 -아무말 3분 뽑아요~~!!! !!,"햄사모 - 햄스터를 사랑하는 모임, 햄스터 다람쥐 저빌 무료분양",4주 전
23年 10月,고맙다 요놈 ~~ 제발 많관부 ……… 오랜만에 강창팸 !!!! 뤂콩시니 축구 볼라고 모엿어염 ⚽️ 시니의 고양이 만드는 과정 완성 ✨ 사장님 벨 고치셔야겟어요 .. 본격 협동 쫀디기 굽기 여전히 고추사랑녀들 ㅋㅋㅋ ✨✌️ 벌써 보고품 ..!! 아빠 생일 축하해요 나는야 도박꾼...,.,4주 전
"[멜버른 4박5일 여행기] 3일차&4일차: 멜버른 시티 투어 (빅토리아 주립 도서관, 세인트 페트릭 성당...",의문 ㅋㅋㅋㅋㅋㅋㅋㅋㅋㅋ 그리고 저 미친 느끼 까르보나라가 2달째 먹고싶음..어카요 저 한국에 저만큼 느끼하게 해주는 곳 없는 것 같은데..ㅈㅂ 나 살려주 그러면 여행기는 케언즈로 다시 돌아옵니다. 많관부 (이제 도시 3개^^밖에 안남았다 힘을 내 얄루야..),몽글몽글한 일상 ✿'◡'✿,4주 전
10月_ 그대들은 10월을 어떻게 살것인가,"다른데 같은 컨셉인게 확실히 보여야함 근데 또 곡들이 다 이어진 느낌 ... 인데 픈 앨범들이 이럼 ... 세계관덕분에 스토리도 이어져서 더 완벽 앨범 발매되면 무족건 1번트랙부터 차례대로 들어줘야함 ,, 이 분야 갑 Fate 11월에 앤 픈 둘 다 정규컴백하거든요 ,, ♡",7.1oz,4주 전
[공략] 혼틈 자주물어보는것 작성,정답이없습니다 제기준으론 상자가 최소 10개이하인곳 잡는데 4~5초 이하로 걸리는곳으로 잡고 사냥했습니다. 절전모드로 1분 비교체크하면서 계속 올라가셔야합니다. 대충이정도이며 헬퍼클랜운영중인 살골이라고합니다. 앞으로 잘부탁드리며 클랜에 많관부~,벽부수기 리부트,4주 전
딱봐도 슈퍼쉴드초드론이네 ㄹㅇ,벚꽃대지연계ㅡ랜마지음ㅡ특블이동 폭탄은 카드론연계 각성 슈퍼쉴드 우비드론 3 많관부 요번이벤 우비팔던데? 믿거나 말거나,모두의마블 모바일 for kakao,4주 전
마감: 비비안웨스트우드 베아가디건/ 지수가디건 BEA 버튼 업 가디건 매장가 60%할인,공홈 사이즈 표 참고 하셔요 ^^ 로마셀럽 11월 이벤트! 구매 하신 분들께 랜덤 선물 예정 ✍구매 후 후기 남겨주시면 다음달 당첨 이벤트 확률 UP! 많은 참여 부탁드려요 ♀️ 매월 1일 로마셀러 이벤트 많관부 &,어스맘 〔명품 구매대행〕,4주 전
10월 어둠이 드리워지는 계절에,app_tapbar_state=hide&fbclid=PAAaaL9rKy-TsLnQJxraZI5Huj9sEv5nYsYpCgSILsRsmugeukB1uU8hpT22g 심지어 이번에 창작뮤지컬이라 인터파크티켓 사이트에도 올라갔다 ❤️많관부❤️ #창작뮤지컬 #뮤지컬동호회 낮은 짧아지고 어둠이 길어지니 아침에 출근할때 남들 잘때 출근하는 기분이고 저녁에...,새로운 새라,4주 전
2천 년 뒤의 너에게,아 쨌든 김가은은 10월의 짓거리들 끄적일거야 그럼 이번에도 많관부 하지마 부댐스러 . . 뭐하는놈이지? @10월2일@ 글쎄 헌혈 할 수 있는... 24시간 내내 활동하는 김가은 부계 많관부 십월오일 아니 몇 달 만에 라면이 진짜 너무 땡기길래 끓이려는데 냄비가 다 뭔 대야만 한...,모든 계절이 유서였다,4주 전
202310_하늘은 높고 나는 달린다,맘에들어서 재탕 회사 안바쁠 시즌에 미친듯이 바빴던게 억울한데 한편으로는 뿌듯 변태기질인가 10월 일기 이렇게 끝 ! 연휴 하나 없는 극악무도 11월이지만 굳세게 야무지게 잘 버텨보자❤️ 할수있다 아잣 읽어주신 분들 넘감삼 알차고 깔쌈할 다음 포스팅도 !,better than yesterday,4주 전
오이런…왜아직도대학생,이번 학기 젤 열심히 참여한거같은(젤 급하게 마무리한거같은 창동 많이도 배우고 많이도 팔았따 마지막은 절 닮앗다고 오백번 들은 동태눈깔의 핏자입니당.. 많관부 했는데 진짜 많관부해주셔서 너무 감사합니댜. 힘둘지만 아자아자 파이팅이당…,H@ppily ever @fter,4주 전
합리적인 소비 + 운전면허 합격,#에어팟맥스 구매성공ㅎ_ㅎ 영롱한 그대의 모습이여.. 장점은 너무너무 간지나요>< 단점은 무거워서 정수리가 빨개집니다ㅋ 요곤 타미 휴무모습ㅋㅋㅋㅋ 저 운전면허 합격했습니다ㅎㅎㅎㅎㅎㅎㅎㅎㅎ 기능은 무려 만점이라고여~ 내가 운전하는 그날까지.. ..,리시엘살롱 타미쌤,4주 전
우리 모두 다 ‘나’인 10월이야,오늘 수련관가서 28일에 하는 축제 준비했당 ✌✌ 히히 신나욤 욤욤뇸뇸 많관부요 ✌✌ 아니 이거 신기해 커피 내리는 건데 이렇게 나오더라? 정말 신기하구만 세상이 .. 우오앙 .. 아프다니까 사주는 친구들 애두라 정말 난 너희 없으면 못살아 ㅜㅜ 제일 좋아해 애두라...,상상을 현실로 만드는 상현 블로그,4주 전
