제목,내용,게시자,게시날짜
태민 단독콘서트 인스파이어아레나 최초공연 아티스트 티켓팅정보,여러쁀 어제 태민이 솔로앨범을 들고 컴백 했는데요 우선 많관부 샤이니 오오랜 팬으로써 무한재생중. 어제부터 무한대로 길티... ticket.melon.com/public/index.html#ticketopen.detail?csoonId=7976 리무진서비스랑 딩고뮤직에 나온 탬니 출처 - SM,스노우의 하루,4주 전
충주 교통대 카공족에게 인기만점인 메가커피(영업시간 ㅇ),"정말 신기했던 메가커피 충주 교통대점이였어요 여기서 일하면 월 300이라는데 순간 혹했던 ~ 교통대 다녔으면 하고도 남았을 것 같네여 ㅎ ㅋㅋㅋㅋㅋㅋㅋㅋㅋ 전직 알바생 / 현직 알바생의 메가커피 메뉴 추천 조만간 2탄으로 찾아올게요 ,, #메가커피...",잘 먹고 잘 노는 공간,4주 전
[October-2 2023],장도 봐야하고 바쁘네요^^ 10-2 내내 약을 먹은 듯 해요. 다들 아프지 마세요 저 감기도 걸렸는데 넘 힘들었거덩요? 일교차 큰데 감기도 조심들 하시고 11월에도 최대한 1일1포스팅 지키려고 할테니 많관부. 제 일상은 15일과 30일 이틀 올라갑니다. 참고바람✨ 이상 끝 #월말정산,Record my day,4주 전
ω 제주고기국수 끝판왕집인 제주도도리고기국수 기록지입니다,꼭 많관부 ω 매장의 이름 _ 제주 도도리고기국수 ω 매장의 주소 _ 제주 제주시 다호북길 109 1층 ω 매장의 번호 _ 0507-1407-5153 ω 기록지 시작 ~ 제주도 하면 꼭 먹어야하는 음식중에 하나는 고기국수 잖아용 ? 저는 유명한 고기국수집보다 제일 맛있으면서 담백하고...,주정뱅이힙찔,4주 전
0.2 반신 커미션,0.2 반신이고요 댓글로 캐릭터 사진보내주시면 계좌번호 적어드립니다ㅏ 일주일정도 걸립니다ㅏ! 많관부@@@@@,네오아카데미,4주 전
오랜만이구나!,어쩌다보니 9월과 10월을 동시에 올리게 되었도다 많관부 많사부 나는야 스몸비 중3 애기들 본문 단어인데 너무나 웃겨서 찍음 ㅎ.. 원장선생님이 챙겨주신 빵.. 마싯다.. 추석기차 장렬히 실패 하지만 은서니가 내것도 잡아줌✌️ 지치고 고된 일상에 예나랑 노천극장에서...,•_•,4주 전
ω대구칠곡3지구맛집 솥뚜껑에 구워먹는 만재네 칠곡3지구점 기록지입니다,꼭 많관부 ω 매장의 이름 _ 만재네 칠곡3지구점 ω 매장의 주소 _ 대구 북구 동천로 125-7 1층 ω 매장의 번호 _ 0507-1364-1928 ω 기록지 시작 ~ 만재네 칠곡3지구점은 솥뚜껑에 전문 그릴러가 다 구워주는 고기집으로 유명하잖아용 ? 다양한 찬 구성으로 같이 솥뚜껑에다가...,주정뱅이힙찔,4주 전
10월_,오랜만에 피시방에서 롤했다 히히~ ㅎ 벌써 11월이다 얘들아 이제 정말 성인되기까지 얼마 안 남았어.!.!.!!! 남은 2023년 좋은 일만 가득하길 바랄게~ 서영이가 준 부적 ㅋㅋ 수능 보는 친구들은 수능 잘 치고 면접 준비하는 친구들은 면접 잘 보고~~ 모두 원하는 대학 붙자,⋰˚☆,4주 전
ω 제주감자탕 고기가 가득 들어가 있는 맛나감자탕제주1호점 기록지입니다,꼭 많관부 ω 매장의 이름 _ 맛나감자탕 제주1호점 ω 매장의 주소 _ 제주시 정촌5길7 ω 매장의 번호 _ 0507-1392-5478 ω 기록지 시작 ~ 저는 감자탕 브랜드중에서 일등은 맛나감자탕이라고 생각을 해용 제주에서 특산물을 먹는게 지겨우시다면 맛나감자탕을 들리는걸 추천을...,주정뱅이힙찔,4주 전
FTV 빌드업 여수 문어선상편 안내,봉강 - 김준 진행자의 여수문어선상편 많관부~^^ ●카페태그● #팀차밍#무늬오징어#볼락#갑오징어#한치#갈치#풀치#전갱이#쏨뱅이#낙지#주꾸미#문어#낚시스페이스#뉴한려피싱#여수야호#스마트피싱몰#인생집어등#일수피싱#머시따선글라스#쪼꼬미에기#씨넥스,팀차밍_Team Charming,4주 전
아디다스 가젤 코어 블랙 팬톤,"잘 신지 않아서 판매합니다. 한 번 착용했고, 사이즈는 270입니다정말 깔끔합니다. 구매하시면 신발상자도 같이 드립니다. 네고 환영입니다!! 많관부!!! 80380547 신발, 중고신발, 스니커즈, 중고스니커즈, 아디다스, 중고아디다스, 번개케어, 중고거래, 중고, 정품",번개케어 정품 스니커즈,4주 전
내전이 많이 열리는 냥냥서버에 어서오세요✨,"많관부입니당! 칼바람, 협곡, 롤체 가리지 않습니다 5인큐 ✨ 어서오셔서 새로운 히어로가 되어주세요 실력이 아이언이라 밸런스 맞춰주는 분 좋아요 종합게임 디스코드라서 다양한 게임을 즐기는 분들이 아주아주 많아요 특히 스팀게임 좋아합니다 04년생 이상...",리그오브레전드 한국커뮤니티 - LoLKor,4주 전
패셔니스타 단체 모집중,패셔니스타 단체 https://open.kakao.com/o/g0IScZFf 마이룸 1등 명이님과 함께하는 패셔니 단체 많관부.. 곧 투표한 후 찍을거라 옾챗 얼른 들어오세요 ㅠㅠ,얼음땡 온라인 공식카페,4주 전
9시부터 아르바 구잉합니다:),9시부터 같이 힐링아르바 하실분들 구합니다!! 못깰시 ㄷㅏ 저의탓..!! 절겁게 하실분들 구해요! 참고로 저는 전문입니다 서포트떠도 상관없으신분들은 높으셔도 되지만은 전설은 최큼 버거운... 아니지 열씨미 하겟...으ㅂ니다.. 용두번보고 헤어져요..!! ..!!!!,"닌텐도 스위치 한국 커뮤니티[동물의숲,포켓몬스터,젤다,마리오]",4주 전
공모전 공지!,사장님 신의상 공모전 공지! 그림실력 보다 사장 맘에 드는 표현력이 중요! 이미지 파일은 작가님과 협의해서 공모전 기간동안만 사용가능하시데요 게시물로는 하나만 올려달라고 하셨습니다 머리스타일은 고정이래요 !,싸이코드 팬카페,4주 전
브루클린웍스 하드쿨러 55QT 판매,"# 네고는 정중히 사양합니다. (현장네고X) # 부피가 커서 직거래 위주로 하겠습니다. # 거래 후 환불 및 반품 불가하오니 신중히 생각해주세요! # 많관부 # 평일 오후5시~6시 용인 기흥 거래가능 그 이후 천안,아산 거래 가능",초캠장터(캠핑퍼스트장터),4주 전
휴가 나온 군인아저씨의 ootd,게시물은 사진+ 글 첨부 필수 상 의1 : 폴로 랄프로렌 바람막이 상 의2 : 무탠타드 쿨텐다드 반팔 하 의 : 플랙 치노 팬츠 신 발 / 제품명 : 뉴발란스 574 헤리티지 액세서리 : 폴로 랄프로렌 모자 키 : 186 몸무게 : 88 나이 : 22 회원님들의 평가 부탁드립니다. 소통해요~ ~,"핏더사이즈 FIT THE SIZE [패션,라이프스타일,일상,취미]",4주 전
★2023 항노화바이오헬스산업체험박람회에서 미니 IR피칭대회가 진행됩니다★,역대 우승자들의 왕중왕전에 참석해 주시는 분들께는 현장 추첨을 통한 이벤트도 준비되어 있으니 많은 관심과 참여바랍니다 ♥ #항노화바이오헬스산업체험박람회 #IR피칭대회 #신사업창업사관학교 #역대우승자 #왕중왕전 #피칭대회 #이벤트 #스타벅스굿즈 #,『창원맘스베베』공구.핫딜.이벤트.중고.캠핑.여행.프리마켓,4주 전
[부대행사] 2023항노화바이오헬스산업체험박람회에서 미니 IR피칭대회가 진행됩니다 ★,역대 우승자들의 왕중왕전에 참석해 주시는 분들께는 현장 추첨을 통한 이벤트도 준비되어 있으니 많은 관심과 참여바랍니다 ⠀ #항노화바이오헬스산업체험박람회 #IR피칭대회 #신사업창업사관학교 #역대우승자 #왕중왕전 #피칭대회 #이벤트 #스타벅스굿즈 #,창원프리마켓카페,4주 전
금손들아 ‼️Attention‼️ 슥슥 그리고 치킨 받아가라,제목은 [꼬붕디자인] 을 포함. 기간 : 231031 ~ 231106 23:59 선정자 발표 : 231107 방송 *네이밍 : 구슬요 / 추천 : 아드리챔 이 두 분은 필수 참여 부탁드립니다. 안하면 절교. *레븐 참여 가능 형님이 그려본 그림 (이 느낌을 따라갈 필요는 없음),헤븐일레븐 (원석대점) :: 레븐 공식 팬카페,4주 전
히힛 드디어,드디어 디코 소통하는 곳이 닫혔네요 뭔가 시원섭섭하긴한데 이게 모든 면에서 좋다고하니... 솔직히 카페를 좀 더 활성화 시키고 싶긴했어요! 이제 카페에서 소통도하고 컨텐츠도 좀 하고! 이것저것 할 예정이니까 다들 많관부~~~~~~,티드의 탐정카페,4주 전
울산기타학원 가을 파티에 모두 흠뻑 연구소 스테이지 첫번째 이야기,영상 열심히 촬영해주시는 용수쌤께도 많은 박수 부탁드려용!ㅎㅎ 끝나지 않은 연구소 스테이지 공연 뒤에 소개드릴 팀은 더욱더 신나고 빵빵한 세션으로 음악을 해주셨는데요? 에푸티 아이 이 랜드팀과 선데이 먼데팀의 무대까지 다음 후기도 드립니다 :),울산기타학원-통기타드럼연구소 (기타/드럼/밴드/레슨),4주 전
<77층> 루나신생길드에서 초기창립멤버를 모집합니다!,많관부~,메이플스토리 - 유저 커뮤니티,4주 전
"""무사고 오늘의 조각 2.0"" part 23. 할로윈 사운드 C존 최저가❤️ (ft. 우열 x 재영)","(눈팅/자객분들 많관부❤️) - ""사운드 심우열"" 또는 ""사운드 재영""님께 카톡/전화로 문의하시면 ""참"" 인정! 폭 방지를 위하여 선입을 원칙으로 합니다. - 실시간 2개, 후기 1개는 필수입니다! (* 미작성 시 모든 이벤트에서 제외되실 수 있으므로, 실시간/후기 꼭...",클럽 무사고-강남클럽/클럽조각/이태원클럽/부산클럽/할로윈/EDM,4주 전
[구Lv.3 분녀씨이제그만] 두레에서 두레원을 모십니다! ♡많관부♡,[분녀씨이제그만] 같이 진득하게 렐팜 즐기실 두레원을 모시고 있습니다! |ૂ•ᴗ•⸝⸝)” 소소한 수다를 나누는 두레 단톡은 필수이지만 조용히 계시고 싶으신 분들을 위한 공지방도 따로 존재합니다! 그 외에 두레 규칙이나 협퀘 관련해서 궁금하신...,레알팜 공식 카페,4주 전
(인스타그램)가수님인스타스토리,이해한다는 말 Understanding 3. 쓰여진 편지 위로 Written Letter 4. 그대와 함께 Together 5. 5분 전 5 Minutes #5집미니앨범 #gift #기프트 #선물 #나의봄날 #이혼해요 #많관부 #잊을수록지울수록지날수록#황치열#기적같은날만오길#,치열스 황치열팬카페(Hwang Chiyeul Fan Cafe),4주 전
Demon Lord 커버 + 1주일 쉬고오겠습니다!,유튜브에서 아직 안 봤으면 들어주시고 어떻게 생각하는지 뎃글로 알려주시면 감사하겠습니다 ㅎㅎ 많관부 많관부 쮸쮸짱커.....쮸쮸짱이뻐....내쮸쮸지만 진짜 이쁘다.... 허니문 엄청 진짜 엄~청 기달렸죠? ㅠㅠ 원레 8월달에 업로드 하고 싶었는데 허니문 9월 10월은...,브이레코드 공식 팬카페,4주 전
칭구구합니다 !!,반갑습니닷 ! 친구창이 없어서 친구 구해봐욥 ! UID : 879098605 많관부..!,원신 공식카페,4주 전
"4달 안에 권리금 회수 가능한 성남 펫토탈샵(분양, 미용, 호텔, 유치원, 용품) 매매, 초보자 가능!","타고 나가야 하는 동네 특성상 홍보 조금만 하면 훨씬 더 잘될 거예요. 저희처럼 요정도 손님만 받으면서 분양까지 같이 가지고 가시거나 아니면 분양 빼고 호텔, 유치원, 미용으로만 더 키우시거나 하면 좋을 것 같아요. 그럼 좋은 분들 연락 기다리고 있겠습니당!",아프니까 사장이다 [소상공인·자영업자·창업],4주 전
10월에는 이런 소식이 있었김!,매월 마지막 날 발간하오니 #많관부 #많은_관심_부탁드립니다 항상 여러분들의 눈 건강을 생각하며 만든 매우 유용한 정보들이니 우리 함께 눈 건강에 관심 가질 수 있게 열심히 달려볼께요~♥ <지난 천안김아이> #1 START :D ☆목차☆ ① 다시보는 눈 건강 정보 [1] 젊은사람도...,천안아산줌마렐라,4주 전
[2023-10-30] 칸나 방송 요약 (휴방날에 찾아온 좀보이드 소풍서버),"많관부 오늘(10/31/화) 6시 or 6시 반쯤 오신다고합니다 커버곡 감상, 수박게임 (3000점 목표) or 좀보이드 소풍서버 예정 ▶이번주 일정 ※변동 가능성 높음※ (11/1/수) : 카페 탐방, 파티애니멀즈 시참, 롤체(후열) (다음날 휴방이니 좀 길게 할 예정) (11/2/목) : 휴방 (11/3~4/금, 토)...",스텔라이브,4주 전
가격인하 다운타운 단기렌트,30 Baseball place 룸1. 단독화장실ok 파킹X 1300불이구요 11월1일~2월말까지 많관부ㅎㅎㅎ 즐거운 하루되세요;),토론토 맘스홀릭,4주 전
21차) 택비받는 나눔용품 나눔 (실리카겔도 있어용!),gs25 택배 - 2000원 입금 일택 = 집으로가는택배 - 착불 <조건> - 일반회원 이상 -나눔예정 있으신분 -여행가는 아가들 있어서 후기 작성해주실분 -큰 택봉은 접혀서가도 괜찮으신분 -택비 입금해주실분 <양식> -아가이름 -아가사진 -반택/일택 선택해주세요 -아무말 ♡,"햄사모 - 햄스터를 사랑하는 모임, 햄스터 다람쥐 저빌 무료분양",4주 전
"*오션뷰* 제주 동쪽에 하도리에 위치한 제주도게스트하우스 @메르블루게스트하우스@에서 11월달 여스텝 1분, 남스텝 1분 모집합니다 ! (15일근무/15일휴무)",일출과 함께 하루를 시작 가족같은 분위기의 메르블루게스트하우스 즐거운 메르블루게스트하우스 2030파티 . . . . #제주도게스트하우스 #메르블루게스트하우스 #한달살이 #제주도한달살이 #메르블루 #파티게스트하우스 #제주도게스트하우스추천 #추천 감사합니다.,제주도 게스트하우스 여행자모임 - 니잘못이아니야,4주 전
"수학학원 강사가 말하는 학원보다 중요한 이것, ‘생각의 span’","아주아주 살앙해요 >-< ?)ㅎㅎㅎㅎ 그럼, 다음에도 알차고 재밌는 정보로 또 찾아올게요 여러분 안뇽~~~ 많관부~!!!! 더레전드 기준수강료(4주기준) 초등 수강료 : 2시간씩 주 3회 30만원 2시간씩 주 4회 40만원 3시간씩 주 2회 30만원 3시간씩 주 3회 45만원 중등 수강료...",일산맘 클라스 상위 1% 공부하는 아이들과 아지매 학원 후기,4주 전
세르주 블로크 : KISS 전시보고왔어요!,"많관부.(*/ω＼*) 이번 전시는 작가님께서 처음으로 한국에서 하는 첫 전시였기에 더 기대했었는데, 기대했던 만큼 더 좋았던 것 같아요. 여기저기 열심히 준비 한게 눈에 보였고, 마냥 행복한 삶에 대해서만 얘기하는 것이 아닌 삶의 굴곡들도 보여주는 작품들이 많아서...",공연 전시 조아,4주 전
회원증대행 해드립니다~,클릭 시 이동 개당 운미 0.4입니다~ 많관부,"프파,스톤,아카 교환판매",4주 전
플럭스 cv s사이즈 삽니다,"아령 1kg)”을 넣어 작성하면, 보다 빠른 판매가 가능합니다! 게시글 작성 시 배송 방법에 “직거래”와 “내 위치” 설정할 경우, 보다 빠른 판매가 가능합니다! 상태 지역확인 후 조정하면 될것같습니다 ( 거리가 안될시 안전거래 진행합니다) !!~",중고나라,4주 전
(끌올) 분양가 내렸어요 개체들도 추가했습니다!,https://cafe.naver.com/greenruby07/360179?tc=shared_link 언능 자리를 비워야하니 네고 문의도 환영합니다! 많관부!!,알뜰한 식물생활,4주 전
타캎 커완,타카페 컴션 후루룩 완료~! 운동다녀와서 저녁 6시에 마카롱 슬롯 열어봅니당 많관부..,커미션나라 ★ 글.그림.만화.애니.캐릭터.로고.디자인 외주제작,4주 전
+ 할로윈 데이 기념 방송 공지!,오늘 얌솜 스타 끝나고 나서 할로윈 기념 타로 봐주기를 할 것 같아요! 의외로 잘 맞는다는 주변에 증언이 있긴해찌 ..후.. 단가는 질문 1개당 100개일 것 같습니다! 짧게 하는거고 자주 없을 이벤트니까 많관부~!٩₍ ᐢ. ̫ .ᐢ ₎و♥,포코톤 크루 공식 팬카페,4주 전
[에르베튈레전] 색색깔깔뮤지엄 초대이벤트,인스타그램으로 초대이벤트 진행중이예요:) 많이 참여해주세요~~ 많관부^^,컬쳐라이프,4주 전
'둥이와꼴통들' 길드원 모집합니다!!!,많은거 안 바래요~ 되도록이면 매일 들어와서 일일미션 다 하실분들 그리고 추방은 최대 3일 까지 봐드려요~~ 많관부!!~~,탕탕특공대 공식 카페,4주 전
보홀간 김루카가 돌고래를 봤다네요,클릭클릭! 간지 며칠이라고 벌써 돌고래를... 간지 며칠이라고 보홀션에만 글을.... 보홀 자유여행을 준비하신다면 보라카이와 같이 보홀션도 많관부!,"보라카이션 - 필리핀 보라카이자유여행, 보라카이여행,맛집,호텔",4주 전
이마트 양산점 공차 OPEN!!!,이마트 양산점 공차 신규 OPEN 음료마시고 보틀 받아가세요. 오늘도 공차하세요 제조음료 2잔 이상 구매시 마이보틀 증정 - 23.10.27.~소진시까지 제조음료 구매시 허니자몽블랙티 증정 - 23.11.3.~ 소진시까지 고객님들의 많은 관심 부탁드립니다. #공차#양산이마트#,양산이야기카페♥양산맘앤파파,4주 전
MZ 언어라고 합니다..,머쓱하다 많관부: 많은 관심 부탁드립니다 만잘부: 만나서 반가워 잘 부탁해 돈쭐: 선행을 배푼 가게의 물건을 대량 구매해준다는 뜻 누물보: 누구 물어본 사람? 너또다 : 너 또라이라 다행이다 남아공: 남아서 공부하기 고렴이: 비싼 제품이라는 뜻 갓생: 남에게 본보기가...,"아파도 직장인: 노무·세무 상담, 직장인 커뮤니티",4주 전
나는 왜 자꾸 미룰까,"(아니 알바끝나니까 11시반이었다구요 ㅜㅜ) 는 변명 날적이 적는 횟수만큼 블로그를 자주 들어오면 좋을 텐데요 날적이 보러 날방 가는 재미가 있어요 헤헤 날적이 많관부! 9월 한 달을 돌아보게 되는데, 참 많은 일이 있었어요 저 정말루,,, 여성영화제를 신나게 즐기고 온...",이화여대 성소수자인권운동모임 변태소녀하늘을날다,2023.09.30.
그럴 일은 없으므로..,"진짜 맛있으니까 다들 많이많이 가주세용 조개탕 진짜 시원하고 맛있음 별청이랑 먹엇는데 별청 순삭함 진짜 미쳣어 오사카 다녀왓거든요 따로 글을 올릴거거든요 많관부 내가 아끼는 맛집 ,,, ㅜㅜㅜㅜ 보다시피 만찬을 즐겨줌 너무 맛있는 한끼였다 ,,, 우리 아우어팸...",everlasting,2023.09.30.
9월 일기 - 일상 조각 모음,ㅎ 230922금요일 모란역 신상 술집 무이 많관부 따로 포스팅 올려야지 '-'♡ 포코 푸딩 플렉스 쓸어오기 엄마랑 은아랑 냠 뀨뀨하우스 첫 집밥 심심해서 윤정이 데리러 갔는데 입구에서 차가 개막 힘 ;; 230923 토요일 추석 연휴가 얼마 안 남은 시점에 세탁기 고장;;;...,"어차피 난 해낼사람, Just Do it",2023.09.30.
sway Sep,질투 열라 나 미띤 시월 육일 일이칠 정규 오집 팩트체크 많관부 자랑샷임 히진이가 뽑아준 스냅스 포카를 케이스 뒤에 넣음 맘에들어서 기절 9.14 카메라 렌즈 안닦음 이슈 하늘이 예쁘길래 가을 온 줄 알았잖아 감쪽같이 속음;; 열라 더웠움 ;; ㄹㅇ 나임 짜증나 ㅜ 수능완성...,deserve it,2023.09.30.
이제우리꿈에서만만나,정아공 사랑합니다 저랑 사궈 ㅎ 끄압 보잘것없는저으블로그를봐주신모든분들께감사인사를 앞으로도많관부요^^~ 조금은 선선해지고 있는 것 같아서 괜히 기분 좋다 요즘 덜 우울한가 나? 전보단 괜찮아진 것 같기도 그치만 불안해 뭐가 불안한 건지는 아직도 모르겠다 그냥...,우리 낭만이 저미는 곳으로 떠날까요,2023.09.30.
황금연휴 0.3초 전 이자 지난..ㅋㅋ,큼큼 많관부 ~!~!~! 청주에서 이렇게 저렴한 네일샵이 ?!?! 기엽띵띵 케이쯔 （＾ω＾）긔염뽀쨕s2 꺄핳ㅎ 칼배송으로 온 신발 남친 책오 뽕빠지게 신어주마 키키 마침 노페 패쪼 산 거 사이즈 교환 했는데 같이 도착했당 기분째져 !! 너도 뽕빠지게 입어주마 대한민국 물가...,김현ズlºl 성공㉥ㅣ법 blØg,2023.09.30.
3단우산 로고각인 주문제작,제품 ^^ 많관부 부탁 드릴게요 : ) 둥근 손잡이로 그립감마저 편-안 한 제품 ^^ 자꾸만 손이가게되는 제품이라 그런지 사용해보시고 좋다고 추천해주셔서 여러곳에서 주문의뢰를 주시더라구요 역시 좋은건 공유가 되고 공유가 되어 멀리멀리 퍼져나가는것같아요 ㅎㅎ...,자몽기프트 정실장 [기념품/홍보물],2023.09.30.
삶은 소중한 거야 살아있는 우리는 후회없이 사랑하자,어햎 많관부 많응부 많사부 도촬하지 말아라 (feat. 옆에서 헬퍼봇 연기 중인 찌미니야) 동규선배랑 지하철 타고 집 가다가 냅다 쫓겨남 ㅋ 출입문 고장이라고 반대편 지하철 타고 집 가기 09. 16 주말인데 만난 F친구 그리고 찌미니야 홍대에 왔습니당 왜냐구요 ? 그건 뒤에...,이롯카,2023.09.30.
[주술회전/ALL] 얘네 또 이벤트 한다 ㅋㅋ,"많관부. 물갈이 당했다거나, 개인 사정으로 나갔다거나, 아무튼 재가입 환영. 회전문 즐깁니다(그렇다고 막 나가진 말아 주라). 저희 내부지도 있어요. 이게 되네? 연애까지 가능한 가장 완벽한 밴드. 그래서 무슨 이벤트 한다고? 급구캐",역극 카페 The Cast,2023.09.30.
정상님 와나나님 방송에서 합방중,멤버 정말 많습니다 다들 알잘딱깔센하게 채팅 쳐주시고 많관부 해주세요~~,원정상과 아귀들의 동물원,2023.09.30.
널 향한 내 마음은 wild and free,케이팝만 들어주는 곳이라 좋앗어요 뭔 먹는얘기밖에없네 할머니 생신이라 갈비를 먹었습니다 크래비티 컴백해스빈다 많관부 노래진짜조음 팔이안으로굽어서그런게아니라진짜좋아요 요즘 핑크브라운에 꽂힘 퍼컬안맞아도 그냥 입는거야 ~!! 럭드를 하러가다 아주 우울한...,spirée d’août,2023.09.30.
응9월이얌ㄷㄷ,그녀의 의견을 반영하여 공스타 만들었으나 응 전혀 안쓰는중^ 제 공스타예요^ 아무것도 안올리지만 많관부~ 걍.. 개웃김 저게 부녀의 대화임ㅋㅋㅋㅋㅋㅋ서로 통보만함 처음으로 속눈썹 붙인날~ 생각보다 마음에 들어서 앞으로 계속 붙이고 다닐듯~ 두끼 알바생과 함께...,모요,2023.09.30.
오워레나,미술시간에 한붓그리기로 그린 누군가 미안하다. 가끔씩 저리 곤하게 자곤 한답니다~~^^ 계속 덧칠되는 무궁화… 6모 당일이자 귀가 전날이다. ㄹㅈㄷ로 못 봤는데 저리 좋을꼬 신나는 귀가날 6월귀가때는 처음 기차 타고 가봐서 새롭고 재밌었다아~~~ 다음 일상도,울랄라,2023.09.30.
9월 정리,많관부 조만간 또 올릴게요 ㅎ 재정이형 군대 가기전에 마지막으로 풋살도 한판 했어요. 잘 다녀오십쇼 햄 이놈의 폰케이스를 바꿔야겠어요 너무 혼자 헬렐레~하네요 . . . 끝났습니다. 사진이 더 없습니다. 다들 9월 마무리 잘 하시고 블로그 올려주세요 찔리시는분...,.,2023.09.30.
9. 열매 달,( 정국이 노래 나왔어요 ‘정국 - 3D’ 많관부 많사부 ♡) 이건 가는 길에 만난 규비닝... ㅎuㅎ ??: 유리야 정국이 생카 가는데 이래도 돼?? 9월 6일~ 9월 8일 #수련회 인생 처음으로 수련회라는 것을 갔다!! 가기 일주일 전부터 너무너무 떨리고 설레서 잠을 설쳤다ㅠ 수련회...,24/7=heaven,2023.09.30.
9월,"함 다들 도적 많관부~~^^ 내가 얘를 따라 팝업을 가는 날이 다 오네 룰렛 돌리기해서 넷플 에코백 받음 vV 완전 보고시펏던 베니스 유령 살인사건 !! 기대만큼 재밌지는 않았지만 볼만햇듬 소금빵 맛집 찾았다 얘들아 >>부천 솔트앤스낵<< 가라,, 꼭 가라,, 진짜 맛집 추석선물로...",♡,2023.09.30.
[✦vlog✦]#2 오타쿠는 최애 이야기에 말이 많아진다,https://youtu.be/GGoV8u5wbsk?si=9mn0kZ-eQPror9-r 2023.09.07 ~ 09.10 오타쿠의 브이로그 남기기 여러분의 사랑에 힘입어 바로 편집했습죠 이번에도 많관부,후후링링,2023.09.30.
벨벳님 0.1 커미션 후기,이게 0.1이랍니다.. 아니 0.4이상은 더 받아야되는겨 아녀␦.ᐟ 원하던 작가님 슬롯을 놓쳐서 아쉬웠지만 벨벳님 컴션오자마자 기분이가 좋아졌습니당 헤헤 한정 커미션이었지만 기습으로 가끔 여신다하시니 벨벳님 많관부해쥬새용,커미션나라 ★ 글.그림.만화.애니.캐릭터.로고.디자인 외주제작,2023.09.30.
[ Winter Spring ] pv 일러스트,다스리는 자여 끝없이 덧칠하는 화가여 패배를 모르는 검이여 영원한 겨울이 닥치리라. 이번 해조 Winter Spring PV에 일러스트로 참여했습니다. 다들 정말 열심히 만드시니 많관부 바랍니다. https://cafe.naver.com/steamindiegame/13139183 < >,왁물원 :: 종합 거시기 스트리머 우왁굳 팬카페,2023.09.30.
